{
  "$schema": "https://json-schema.org/draft/2020-12/schema",
  "$comment": "SkillLatch grant v2 (adds the workspace_id pin). Documentation-grade: the reference parser in skilllatch/core.py is authoritative. Known looseness vs the parser: (1) timestamps are pattern-checked only; calendar validity (e.g. month 13) is not verified; (2) the grant window rule (expires_at - issued_at must be > 0 and <= 24 hours) is not expressible; (3) the RELPATH pattern does not reject Windows device names or components with a trailing space or dot; (4) network items are constrained only by the origin-only pattern, not the parser's full host rules; (5) JSON Schema 'integer' accepts 1.0, the parser requires a type-exact int; (6) duplicate object keys and nonfinite numbers are invisible to JSON Schema; (7) the 256/256/64 capability caps are not expressed. The capabilities object is inlined (no $defs/$ref) so every schema file stays self-contained for editor tooling.",
  "type": "object",
  "required": ["version", "session_id", "task_id", "skill_digest", "workspace_id", "issued_at", "expires_at", "capabilities"],
  "additionalProperties": false,
  "properties": {
    "version": {"type": "integer", "const": 2},
    "session_id": {
      "type": "string",
      "minLength": 1,
      "pattern": "^[^\\u0000-\\u001F\\u007F]+$"
    },
    "task_id": {
      "type": "string",
      "minLength": 1,
      "pattern": "^[^\\u0000-\\u001F\\u007F]+$"
    },
    "skill_digest": {"type": "string", "pattern": "^sha256:[0-9a-f]{64}$"},
    "workspace_id": {
      "type": "string",
      "minLength": 1,
      "pattern": "^[^\\u0000-\\u001F\\u007F]+$"
    },
    "issued_at": {
      "type": "string",
      "pattern": "^\\d{4}-\\d{2}-\\d{2}T\\d{2}:\\d{2}:\\d{2}(\\.\\d{1,6})?Z$"
    },
    "expires_at": {
      "type": "string",
      "pattern": "^\\d{4}-\\d{2}-\\d{2}T\\d{2}:\\d{2}:\\d{2}(\\.\\d{1,6})?Z$"
    },
    "capabilities": {
      "type": "object",
      "required": ["files", "network", "commands"],
      "additionalProperties": false,
      "properties": {
        "files": {
          "type": "object",
          "required": ["read", "write"],
          "additionalProperties": false,
          "properties": {
            "read": {
              "type": "array",
              "items": {
                "type": "object",
                "required": ["path", "recursive"],
                "additionalProperties": false,
                "properties": {
                  "path": {
                    "type": "string",
                    "pattern": "^(?!/)(?!.*//)(?!.*/$)(?!.*(?:^|/)\\.\\.?(?:/|$))[^\\\\:*?<>|\"\\u0000-\\u001F\\u007F]+$"
                  },
                  "recursive": {"type": "boolean"}
                }
              }
            },
            "write": {
              "type": "array",
              "items": {
                "type": "object",
                "required": ["path", "recursive"],
                "additionalProperties": false,
                "properties": {
                  "path": {
                    "type": "string",
                    "pattern": "^(?!/)(?!.*//)(?!.*/$)(?!.*(?:^|/)\\.\\.?(?:/|$))[^\\\\:*?<>|\"\\u0000-\\u001F\\u007F]+$"
                  },
                  "recursive": {"type": "boolean"}
                }
              }
            }
          }
        },
        "network": {
          "type": "array",
          "items": {
            "type": "string",
            "minLength": 1,
            "pattern": "^https://[^/\\\\?#\\s]+$"
          }
        },
        "commands": {
          "type": "array",
          "items": {
            "type": "array",
            "minItems": 1,
            "items": {
              "type": "string",
              "minLength": 1,
              "pattern": "^[^\\u0000-\\u001F\\u007F]+$"
            }
          }
        }
      }
    }
  }
}
